all_awardings,associated_award,author,author_flair_background_color,author_flair_css_class,author_flair_richtext,author_flair_template_id,author_flair_text,author_flair_text_color,author_flair_type,author_fullname,author_patreon_flair,author_premium,awarders,body,collapsed_because_crowd_control,comment_type,created_utc,gildings,id,is_submitter,link_id,locked,no_follow,parent_id,permalink,retrieved_on,score,send_replies,stickied,subreddit,subreddit_id,top_awarded_type,total_awards_received,treatment_tags
[],,learningeverythings,,,[],,,,text,t2_ardom6c8,False,False,[],"AS I mention about my project Estuary part is my job and I behind my schedule,  
Going through books will take a lot of time, therefore this method  
Sorry, if you get any kind of trouble ... But you help a lot Thanks for that",,,1615436001,{},gqj6260,True,t3_m239f6,False,True,t1_gqj1f40,/r/oceanography/comments/m239f6/is_there_no_mix_of_freshwater_and_seawater_in_the/gqj6260/,1615440525,1,True,False,oceanography,t5_2rez7,,0,[]
[],,doughnuts58008,,,[],,,,text,t2_8g525r8a,False,False,[],"Wonder what other kinda goodies they might find along the way? Pretty sure I lost a few treasure chests out there, please return them",,,1615434181,{},gqj38a0,False,t3_m2eqxo,False,True,t3_m2eqxo,/r/oceanography/comments/m2eqxo/two_hightech_deepsea_robots_that_will_comb_large/gqj38a0/,1615439310,1,True,False,oceanography,t5_2rez7,,0,[]
[],,Lost_Piece_1911,,,[],,,,text,t2_a9ze6n7c,False,False,[],"Youre lying. You made two accounts.

They will always mix very slowly. I dont know of any that never mix. What is this line of questioning trying to accomplish?",,,1615433189,{},gqj1f40,False,t3_m239f6,False,True,t1_gqiw1up,/r/oceanography/comments/m239f6/is_there_no_mix_of_freshwater_and_seawater_in_the/gqj1f40/,1615438537,1,True,False,oceanography,t5_2rez7,,0,[]
[],,BlankVerse,,,[],,,,text,t2_97a3,False,False,[],"Excerpt: 

&gt; When Californians learned in October that the waters off Santa Catalina Island once served as a dumping ground for thousands of barrels of DDT waste, the ocean science community jumped into action.

&gt; A crew was swiftly assembled, shipping lanes cleared, the gears set in motion for a deep-sea expedition aboard the Sally Ride, one of the most technologically advanced research vessels in the country.

&gt; By Wednesday, the ship was ready to leave San Diego and head for the San Pedro Basin, where 31 scientists and crew members will spend the next two weeks surveying almost 50,000 acres of the seafloor — a much-needed first step in solving this toxic mystery that the ocean had buried for decades.

&gt; “We want to provide a common base map of what’s on the seabed at a high enough resolution,” said Eric Terrill of UC San Diego’s Scripps Institution of Oceanography, who is leading an effort made possible by the many scientists and federal officials who helped fast-track this expedition. “There were a lot of heroics pulled by quite a few people ... to make this happen.”

&gt; Public calls for action have intensified since The Times reported that the nation’s largest manufacturer of DDT once dumped its waste into the deep ocean. As many as half a million barrels could still be underwater today, according to old records and a recent UC Santa Barbara study that provided the first real glimpse of this pollution bubbling 3,000 feet under the sea.

&gt; “These barrels are full of toxic chemicals that could be causing illness among ocean wildlife and even humans. Ignoring it or claiming it’s just too difficult to deal with is not an option,” said Sen. Dianne Feinstein (D-Calif.), who has pushed numerous agencies to make this issue a priority. “The Biden administration has indicated it’s interested in taking action, and I intend to stay on them.”",,,1615427232,{},gqiqabf,True,t3_m2eqxo,False,True,t3_m2eqxo,/r/oceanography/comments/m2eqxo/two_hightech_deepsea_robots_that_will_comb_large/gqiqabf/,1615433057,1,True,False,oceanography,t5_2rez7,,0,[]
[],,isodoria,,,[],,,,text,t2_6cew6sys,False,False,[],"Do you understand the salinity gradient part? 

The sentence you underlined means that before there is such a large salinity differential between the two sides of the estuary (landward and seaward), neither the fresh water from the estuary nor the salt water from the sea can cross this boundary. Does that make sense?",,,1615409694,{},gqhqjdm,False,t3_m1zq80,False,True,t3_m1zq80,/r/oceanography/comments/m1zq80/can_anyone_explain_the_red_line/gqhqjdm/,1615415871,2,True,False,oceanography,t5_2rez7,,0,[]
