all_awardings,associated_award,author,author_flair_background_color,author_flair_css_class,author_flair_richtext,author_flair_template_id,author_flair_text,author_flair_text_color,author_flair_type,author_fullname,author_patreon_flair,author_premium,awarders,body,collapsed_because_crowd_control,comment_type,created_utc,gildings,id,is_submitter,link_id,locked,no_follow,parent_id,permalink,retrieved_on,score,send_replies,stickied,subreddit,subreddit_id,top_awarded_type,total_awards_received,treatment_tags
[],,Lost_Piece_1911,,,[],,,,text,t2_a9ze6n7c,False,False,[],"Just be honest that you and the other person are one and the same haha.

Theres mixing but much much slower. The turbulence wont be occur; the heavier denser water stays below the fresh water.",,,1615398675,{},gqgzgb9,False,t3_m239f6,False,True,t3_m239f6,/r/oceanography/comments/m239f6/is_there_no_mix_of_freshwater_and_seawater_in_the/gqgzgb9/,1615402125,2,True,False,oceanography,t5_2rez7,,0,[]
[],,JoaSnick,,,[],,,,text,t2_3ajbpkge,False,False,[],"Not in the case when the evaporation in the ""plug area"" is strong enough to create that wall of dense water. But I guess that State is strongly dependent on seasonal cycles. And if there is lots of Wind or other strong tidal currents, for example, they could probably break through the plug. 

But that is only my understanding...",,,1615393859,{},gqgmfw9,False,t3_m1zq80,False,True,t1_gqgkjxq,/r/oceanography/comments/m1zq80/can_anyone_explain_the_red_line/gqgmfw9/,1615395344,1,True,False,oceanography,t5_2rez7,,0,[]
[],,RoundAlternative1106,,,[],,,,text,t2_541k3mzu,False,False,[],So there not at all mixing of seawater and freshwater?,,,1615393108,{},gqgkjxq,True,t3_m1zq80,False,True,t1_gqgi34f,/r/oceanography/comments/m1zq80/can_anyone_explain_the_red_line/gqgkjxq/,1615394345,1,True,False,oceanography,t5_2rez7,,0,[]
[],,JoaSnick,,,[],,,,text,t2_3ajbpkge,False,False,[],"If I remember correctly, this ""plug"" is the area where landwards and seawards the water density decreases. Due to high evaporation in that area, you will also find that super-dense water on the surface. So you kind of have a vertical wall of dense water that makes it hard or even impossible for seawater or water from the river to breake through it. Hence river water won't mix with the seawater behind that ""plug"".",,,1615392146,{},gqgi34f,False,t3_m1zq80,False,True,t3_m1zq80,/r/oceanography/comments/m1zq80/can_anyone_explain_the_red_line/gqgi34f/,1615393093,1,True,False,oceanography,t5_2rez7,,0,[]
[],,chuckles11,,,[],,,,text,t2_1og4h0py,False,False,[],"Oh interesting, is your work (or the method your work is based off of) available in some sort of publication I could look at?",,,1615300273,{},gqbwlne,True,t3_m0gkp0,False,True,t1_gqan21f,/r/oceanography/comments/m0gkp0/ocean_upwelling_data_thats_free_to_the_public/gqbwlne/,1615300285,1,True,False,oceanography,t5_2rez7,,0,[]
[],,hobbitNZ,,,[],,,,text,t2_5me2p,False,False,[],"I’ve used NOAA SST data alongside NCEP wind stress data to calculate regional Ekman induced upwelling and downwelling. This was a while ago, but could still be viable for you.",,,1615264901,{},gqan21f,False,t3_m0gkp0,False,True,t3_m0gkp0,/r/oceanography/comments/m0gkp0/ocean_upwelling_data_thats_free_to_the_public/gqan21f/,1615266036,1,True,False,oceanography,t5_2rez7,,0,[]
[],,stayschemin_17,,,[],,,,text,t2_35awclhu,False,False,[],The Puget Sound in Seattle has some really interesting upwelling patterns. Sorry I can’t tell you exactly where to look for the data but there are lots of public groups that publish data about it,,,1615246260,{},gq9pk6n,False,t3_m0gkp0,False,True,t3_m0gkp0,/r/oceanography/comments/m0gkp0/ocean_upwelling_data_thats_free_to_the_public/gq9pk6n/,1615250225,1,True,False,oceanography,t5_2rez7,,0,[]
[],,BluScr33n,,,[],,,,text,t2_xa2rs,False,False,[],"i'm pretty sure every student of (physical) oceanography has read this book lol.

https://www.oercommons.org/courses/dr-robert-stewarts-physical-oceanography-class-page/view",,,1615242208,{},gq9hksw,False,t3_m0nypl,False,True,t3_m0nypl,/r/oceanography/comments/m0nypl/newcomer_to_oceanography/gq9hksw/,1615246421,1,True,False,oceanography,t5_2rez7,,0,[]
[],,spac3funk,,,[],,,,text,t2_14uyah,False,False,[],"Hello a newbie myself . So totally off topic , disclosing astrology interest to the scientific community is a bad idea . You will get ridiculed at some point . I’m a Scorpio, my best friends are Cancers (water &amp; water ) . Both of my previous bosses are are scorps and worked with aquatic life . So yeah we are made for it .",,,1615236158,{},gq9433m,False,t3_m0nypl,False,True,t3_m0nypl,/r/oceanography/comments/m0nypl/newcomer_to_oceanography/gq9433m/,1615239928,2,True,False,oceanography,t5_2rez7,,0,[]
[],,Chlorophilia,,,[],,,,text,t2_idccd,False,False,[],"It depends on whether you're happy to infer upwelling from SST, or whether you need the actual velocity data. 

If it's just SST you want, obtaining these data is easy and I would recommend using ERA5. As /u/Mafa_windgesang suggested, it is also possible to calculate the wind-driven component of upwelling from wind stress data in ERA5, but I honestly wouldn't recommend this as, without a background in oceanography and basic programming, this could be painful.

There is a more straightforward way of getting the vertical velocities, namely by using the output of a numerical model. A good example is the [GLORYS12V1](https://resources.marine.copernicus.eu/?option=com_csw&amp;view=details&amp;product_id=GLOBAL_REANALYSIS_PHY_001_030) reanalysis from CMEMS where you can obtain the estimated vertical velocities at different depth layers from 1993-2019. This is not quite as easy as just downloading a geotiff, as practically all large datasets in Earth Sciences are in the netcdf format, although it may still be possible to import this into QGIS. Otherwise, there are several netcdf viewers out there such as Panoply. If you wanted estimates of vertical velocities for right now, CMEMS also has a forecast model that you can use (but these data have more uncertainty than the reanalysis).",,,1615225980,{},gq8gg99,False,t3_m0gkp0,False,True,t3_m0gkp0,/r/oceanography/comments/m0gkp0/ocean_upwelling_data_thats_free_to_the_public/gq8gg99/,1615227905,1,True,False,oceanography,t5_2rez7,,0,[]
[],,chuckles11,,,[],,,,text,t2_1og4h0py,False,False,[],Thank you! I will explore this.,,,1615222890,{},gq88x32,True,t3_m0gkp0,False,True,t1_gq7oyq1,/r/oceanography/comments/m0gkp0/ocean_upwelling_data_thats_free_to_the_public/gq88x32/,1615224037,1,True,False,oceanography,t5_2rez7,,0,[]
[],,chuckles11,,,[],,,,text,t2_1og4h0py,False,False,[],Ah thanks! Yeah my interest is in Ekman Upwelling right now (but your mention of other types of upwelling intrigues me). I'll check this out! And to answer your threaded question I've been mainly sticking with open source for budget reasons. I'd love to use some ESRI software but it's QGIS for me...,,,1615222879,{},gq88w5c,True,t3_m0gkp0,False,True,t1_gq7rtk8,/r/oceanography/comments/m0gkp0/ocean_upwelling_data_thats_free_to_the_public/gq88w5c/,1615224023,1,True,False,oceanography,t5_2rez7,,0,[]
[],,Mafa_windgesang,,,[],,,,text,t2_5psh2lt4,False,False,[],"Another good way of approaching it, especially if you have some experience in data analysis, is to explore the ERA5 reanalysis dataset. Using wind velocity and Ekman’s theory you can derive the integrated transport and the vertical current speed. There are other types of upwelling you can explore but Ekman is always a good place to start.",,,1615216527,{},gq7u49k,False,t3_m0gkp0,False,True,t3_m0gkp0,/r/oceanography/comments/m0gkp0/ocean_upwelling_data_thats_free_to_the_public/gq7u49k/,1615216548,1,True,False,oceanography,t5_2rez7,,0,[]
[],,Lost_Piece_1911,,,[],,,,text,t2_a9ze6n7c,False,False,[],"Go read the other posts and replies! So you all know eachother and ask very similar questions, hookay.

You dont seem to like the answer: you can call it a partial barrier but I wouldnt. They will be mixing at a slower rate. Its not a layer or a line; its just a spot where two water masses meet and mix slowly because of differences in physical properties.",,,1615131911,{},gq3ss3v,False,t3_lzqkkt,False,True,t1_gq3qsxs,/r/oceanography/comments/lzqkkt/debate_on_seas_meeting/gq3ss3v/,1615131923,1,True,False,oceanography,t5_2rez7,,0,[]
[],,learningeverythings,,,[],,,,text,t2_ardom6c8,False,False,[],"If the ""other one"" is one creating a computer simulation of water then yes, he is also my friend but I am not debating with him(RoundAlternative).  
HE gives me the idea to ask it on Reddit.  
Does my friend's (not project one ) statement is right is there a barrier distinguish their temperature, density, etc?",,,1615130851,{},gq3qsxs,True,t3_lzqkkt,False,True,t1_gq3paxe,/r/oceanography/comments/lzqkkt/debate_on_seas_meeting/gq3qsxs/,1615130862,1,True,False,oceanography,t5_2rez7,,0,[]
[],,Lost_Piece_1911,,,[],,,,text,t2_a9ze6n7c,False,False,[],"I have a sneaking suspicioun this brand new account is related to the other one asking all the pycnocline questions.

Read the other replies from the other pycnocline posts. They still mix, it is a permeable boundary which slows mixing becuase of physical properties. Pycnocline = change in density but also haloclone=change in salinity and thermocline= change in heat.

All these occur between major water masses. They slide on eachother and mix, but those gradients exist for a reason: heat transfers 100x faster than salinity, so as waters warm they rise, and as they gain more salinity or density they sink. This overturning is slow in huge masses but fast in turbulent coastlines",,,1615130003,{},gq3paxe,False,t3_lzqkkt,False,True,t3_lzqkkt,/r/oceanography/comments/lzqkkt/debate_on_seas_meeting/gq3paxe/,1615130014,1,True,False,oceanography,t5_2rez7,,0,[]
[],,learningeverythings,,,[],,,,text,t2_ardom6c8,False,False,[],Consider all seas,,,1615126658,{},gq3jw7b,True,t3_lzqkkt,False,True,t1_gq3il9i,/r/oceanography/comments/lzqkkt/debate_on_seas_meeting/gq3jw7b/,1615126668,1,True,False,oceanography,t5_2rez7,,0,[]
[],,crocomut,,,[],,,,text,t2_4harn,False,False,[],https://i.imgur.com/IScXA3b.png,,,1614818118,{},gplkfxs,False,t3_lwlses,False,True,t3_lwlses,/r/oceanography/comments/lwlses/can_anyone_clear_my_doubt/gplkfxs/,1614972024,1,True,False,oceanography,t5_2rez7,,0,[]
[],,Lost_Piece_1911,,,[],,,,text,t2_a9ze6n7c,False,False,[],"Descriptive Phys Oceanography, 6th edition, Talley and others",,,1614782795,{},gpjdpp2,False,t3_lwlses,False,False,t1_gpj5nfc,/r/oceanography/comments/lwlses/can_anyone_clear_my_doubt/gpjdpp2/,1614930193,1,True,False,oceanography,t5_2rez7,,0,[]
[],,xossiane,,,[],,,,text,t2_618350d3,False,False,[],definitely a coral,,,1614781303,{},gpjamht,False,t3_ldj9zp,False,True,t3_ldj9zp,/r/oceanography/comments/ldj9zp/can_someone_tell_me_what_this_is/gpjamht/,1614928614,0,True,False,oceanography,t5_2rez7,,0,[]
[],,RoundAlternative1106,,,[],,,,text,t2_541k3mzu,False,False,[],"Thanks for helping ...
Can you suggest a book on physics oceanography",,,1614778654,{},gpj5nfc,True,t3_lwlses,False,False,t1_gpj0v2w,/r/oceanography/comments/lwlses/can_anyone_clear_my_doubt/gpj5nfc/,1614926109,2,True,False,oceanography,t5_2rez7,,0,[]
[],,Lost_Piece_1911,,,[],,,,text,t2_a9ze6n7c,False,False,[],"The pycnocline isnt a brick wall, mixing will occur at that point. It will be a barrier to some and slows mixing down, water does not want to flow into the path of resistance, but the water on either side will move and create turbulence, mixing the two together.

To understand this mixing, look up TS diagrams, temperature/salinity graphs. This tells a little more about how two water masses like this mix.",,,1614775708,{},gpj0v2w,False,t3_lwlses,False,False,t1_gpizo3s,/r/oceanography/comments/lwlses/can_anyone_clear_my_doubt/gpj0v2w/,1614923761,4,True,False,oceanography,t5_2rez7,,0,[]
[],,RoundAlternative1106,,,[],,,,text,t2_541k3mzu,False,False,[],"Thanks for helping
One last Question :On Wikipedia page of Pycnonline they write  ""vertical mixing across a pycnonline is regular phenomenon in oceans,and occurs through shear produced turbulence""
But in physics function of Pycnonline they have written ""pycnonline act as barrier to vertical circulation circulation""
So Q is that pycnonline act barrier but water can mixing by physics means i.e turbulence,tides etc ?",,,1614774882,{},gpizo3s,True,t3_lwlses,False,False,t1_gpiyuyx,/r/oceanography/comments/lwlses/can_anyone_clear_my_doubt/gpizo3s/,1614923177,1,True,False,oceanography,t5_2rez7,,0,[]
[],,Lost_Piece_1911,,,[],,,,text,t2_a9ze6n7c,False,False,[],"POceanographer here, this is my jam. 

Dont think of brackish water as a solid block like that, brackish will be up the river tidally. What I mean to say is that there will be mixing constantly, and depending on the tides, the pycnocline can be more vertical or more horizontal. A pycnocline is a rapid change in density with change in depth, a gradient that makes mixing tougher, but its not its own layer. The most dramatic example is oil and water not mixing and layering themselves.

Your latter is correct, mixing is always occurring through tides and winds. Brackish water is upstream. Ocean salinity is lets say 30ish psu (salinity units, how salty), and fresh is little to none. Brackish is well mixed upstream water. Water masses like these will rarely fully mix when in stream but wedge over and under eachother, with the denser seawater pushing under the lighter freshwater.",,,1614774306,{},gpiyuyx,False,t3_lwlses,False,False,t3_lwlses,/r/oceanography/comments/lwlses/can_anyone_clear_my_doubt/gpiyuyx/,1614922791,8,True,False,oceanography,t5_2rez7,,0,[]
[],,[deleted],,,,,,dark,,,,,[],[deleted],,,1614756661,{},gpifjqz,False,t3_lwlses,False,True,t3_lwlses,/r/oceanography/comments/lwlses/can_anyone_clear_my_doubt/gpifjqz/,1614913695,1,True,False,oceanography,t5_2rez7,,0,[]
[],,Lost_Piece_1911,,,[],,,,text,t2_a9ze6n7c,False,False,[],"Definitely not new, but I love that its being talked about. Should be a bigger deal. Changing earth =/= just sea level rise.",,,1614721649,{},gpgp86o,False,t3_lwbyp9,False,True,t3_lwbyp9,/r/oceanography/comments/lwbyp9/atlantic_ocean_circulation_at_weakest_in_a/gpgp86o/,1614725986,2,True,False,oceanography,t5_2rez7,,0,[]
[],,Lost_Piece_1911,,,[],,,,text,t2_a9ze6n7c,False,False,[],Spam bot,,,1614257686,{},gop7jid,False,t3_ls1cl8,False,True,t3_ls1cl8,/r/oceanography/comments/ls1cl8/ocean_waves_relaxation_1_hour_soothing_waves/gop7jid/,1614401530,4,True,False,oceanography,t5_2rez7,,0,[]
[],,hero_protagonist,,,[],,,,text,t2_5j6sf,False,False,[],"That sounds really cool! In that case, you might also want to check out the vertical surface displacement data from CDIP. You'll have to decode the timestamp from an start time and the sampling frequency (in Hz), but I think they are sampled at around 1 or 2 Hz.

Here is an example: [https://thredds.cdip.ucsd.edu/thredds/dodsC/cdip/realtime/157p1\_xy.nc](https://thredds.cdip.ucsd.edu/thredds/dodsC/cdip/realtime/157p1_xy.nc) 

Good luck!",,,1614212330,{},gonafhs,False,t3_lrjdfd,False,True,t1_gomoihx,/r/oceanography/comments/lrjdfd/looking_for_high_resolution_buoy_data/gonafhs/,1614366800,2,True,False,oceanography,t5_2rez7,,0,[]
[],,BluScr33n,,,[],,,,text,t2_xa2rs,False,False,[],"Ocean networks canada has a lot of data freely available. It might not have a lot of buoy data, but they have sea surface hight data from ADCPs, that should have the necessary resolution for you.",,,1614208410,{},gon2cs1,False,t3_lrjdfd,False,False,t3_lrjdfd,/r/oceanography/comments/lrjdfd/looking_for_high_resolution_buoy_data/gon2cs1/,1614362896,2,True,False,oceanography,t5_2rez7,,0,[]
[],,VeskiBateman,,,[],,,,text,t2_941jjsfk,False,False,[],"Hey, thanks for the response. My application is an ocean wave parser. I intend to parse 1d wave data as a sentence and use that process to derive semantic information from waves. Thank you so much for the link. The buoy seems capable of producing data in 15 second intervals but has only done so a handful of times.  


This is some of the most frequent data I have yet seen though, so I am hopeful that the data is out there somewhere.  
If all else fails I intend to generate my own data though this would take me more time - something that is at a premium.",,,1614201164,{},gomoihx,False,t3_lrjdfd,False,True,t1_gomi644,/r/oceanography/comments/lrjdfd/looking_for_high_resolution_buoy_data/gomoihx/,1614355961,2,True,False,oceanography,t5_2rez7,,0,[]
[],,tansoku,,,[],,,,text,t2_o48z8,False,False,[],"Here is a pretty extensive list of ocean data links. Some are Hawaii-centric, but there are links to a number of sources that may be helpful. 

[https://www.soest.hawaii.edu/soestwp/research/data/](https://www.soest.hawaii.edu/soestwp/research/data/)",,,1614200424,{},gomneca,False,t3_lrjdfd,False,True,t3_lrjdfd,/r/oceanography/comments/lrjdfd/looking_for_high_resolution_buoy_data/gomneca/,1614355375,2,True,False,oceanography,t5_2rez7,,0,[]
[],,hero_protagonist,,,[],,,,text,t2_5j6sf,False,False,[],"Can I ask what the application is? Are you looking to resolve some type of wave from surface displacement or some other application using sea surface height, which is measured in reference to a datum? It is really expensive in terms of power consumption and bandwidth to send raw data, so measurements are usually averaged over 15 minutes to an hour, which also helps reduce noise on the instruments. 

I think your best bet might be to look at data from the DART buoys, which are specifically used for measuring tsunamis. They have a pressure sensor that is mounted to the bottom of the ocean and can measure the pressure at really heigh resolution.

For example: Buoy 32411 has pressure measured at 15 second intervals. Here is a the data from a deployment from 2016-2018:

[https://www.ngdc.noaa.gov/thredds/dodsC/dart\_bpr/processed/32411/32411\_20160318to20180206\_qc.nc.html](https://www.ngdc.noaa.gov/thredds/dodsC/dart_bpr/processed/32411/32411_20160318to20180206_qc.nc.html)",,,1614198423,{},gomi644,False,t3_lrjdfd,False,False,t3_lrjdfd,/r/oceanography/comments/lrjdfd/looking_for_high_resolution_buoy_data/gomi644/,1614352544,1,True,False,oceanography,t5_2rez7,,0,[]
[],,VeskiBateman,,,[],,,,text,t2_941jjsfk,False,False,[],Thank you both; these are the best resolutions I've yet to find at between 6 and 10 minutes. Still way off though. Looks like I might need to generate the data.,,,1614194491,{},gom8o6z,False,t3_lrjdfd,False,True,t1_gom2voi,/r/oceanography/comments/lrjdfd/looking_for_high_resolution_buoy_data/gom8o6z/,1614347126,1,True,False,oceanography,t5_2rez7,,0,[]
[],,tansoku,,,[],,,,text,t2_o48z8,False,False,[],Also check out ioos.noaa.gov,,,1614193575,{},gom6be1,False,t3_lrjdfd,False,True,t1_gom2voi,/r/oceanography/comments/lrjdfd/looking_for_high_resolution_buoy_data/gom6be1/,1614345827,2,True,False,oceanography,t5_2rez7,,0,[]
[],,Lost_Piece_1911,,,[],,,,text,t2_a9ze6n7c,False,False,[],"No problem. 

ndbc.noaa.gov",,,1614192461,{},gom3cu5,False,t3_lrjdfd,False,True,t1_gom2voi,/r/oceanography/comments/lrjdfd/looking_for_high_resolution_buoy_data/gom3cu5/,1614344315,2,True,False,oceanography,t5_2rez7,,0,[]
[],,VeskiBateman,,,[],,,,text,t2_941jjsfk,False,False,[],I will check this out for sure. Many thanks.,,,1614192282,{},gom2voi,False,t3_lrjdfd,False,True,t1_gom19tj,/r/oceanography/comments/lrjdfd/looking_for_high_resolution_buoy_data/gom2voi/,1614344074,1,True,False,oceanography,t5_2rez7,,0,[]
[],,Lost_Piece_1911,,,[],,,,text,t2_a9ze6n7c,False,False,[],"Look at NDBC national data buoy center from NOAA. Different buoys with different amounts of data. Some have sea surface height, others have cont. Winds with 10 min averages. Without paying for a data set Id be surprised if you find second precision but Id be interested, let  us know.",,,1614191694,{},gom19tj,False,t3_lrjdfd,False,True,t3_lrjdfd,/r/oceanography/comments/lrjdfd/looking_for_high_resolution_buoy_data/gom19tj/,1614343273,3,True,False,oceanography,t5_2rez7,,0,[]
[],,VeskiBateman,,,[],,,,text,t2_941jjsfk,False,False,[],Thank you for posting for me! :),,,1614190363,{},golxntl,False,t3_lrjdfd,False,False,t3_lrjdfd,/r/oceanography/comments/lrjdfd/looking_for_high_resolution_buoy_data/golxntl/,1614341502,2,True,False,oceanography,t5_2rez7,,0,[]
[],,Scuzwheedl0r,,,[],,,,text,t2_3dc6k,False,False,[],"Here are a couple of other interesting topics you might like to look into:

Many of the animals that live at the surface of the ocean are bright blue. Why is that and what does it do for them?

Tiny animals the size of a flea travel up and down in the water column, twice a day, distances that would compare to us climbing a mountain! Why do they do that, and how?

The ocean surface is not flat. In fact, there is a mound of water in the middle of the pacific that is almost a meter tall, and thousands of miles wide! Why is it there, and what does it mean for life that lives in that water?

Good luck out there!",,,1614151353,{},gok5zdj,False,t3_lqqbju,False,True,t3_lqqbju,/r/oceanography/comments/lqqbju/paper_for_oceanography/gok5zdj/,1614308827,2,True,False,oceanography,t5_2rez7,,0,[]
[],,Myctophid,,,[],,,,text,t2_2lsain4f,False,False,[],"There’s a lot of great work out there on marine turtle migration patterns, pelagic habitat, and fishery interactions, so maybe don’t give up on that topic unless they told you “no way!!”

I’d echo what others are saying about reading a few papers on the topic, but I also recommend deciding which species you want to look at and which general part of the world. Leatherback turtles are extremely cool, but loggerheads also have a lot of interesting research done on their migration patterns. I wrote my MS thesis on this stuff, so I’m a little biased, but like another commenter said- lots of people get interested in turtles and whales. Charismatic megafauna are.....pretty charismatic! Here are a few good papers to read, not super technical or crazy. Enjoy!

[loggerheads pacific](https://www.sciencedirect.com/science/article/abs/pii/S0022098107005734)

[loggerheads Atlantic](https://www.sciencedirect.com/science/article/abs/pii/S0079661110000431)

[sea turtle bycatch mitigation in longline fisheries](https://www.frontiersin.org/articles/10.3389/fmars.2017.00260/full)

[leatherback migrations](https://www.int-res.com/abstracts/meps/v337/p245-254/)",,,1614143190,{},gojv4tk,False,t3_lqqbju,False,True,t1_gohw4gn,/r/oceanography/comments/lqqbju/paper_for_oceanography/gojv4tk/,1614303710,1,True,False,oceanography,t5_2rez7,,0,[]
[],,ItsMetheDeepState,,,[],,,,text,t2_4vz4c8nz,False,False,[],"It's ok, you're not wasting anyone's time.

 The hostility you're feeling is just other people wanting to help narrow down the topic so they can better help guide your research. Oceanography is a HUGE field. It's a bit like asking: 

""I need to do a topic on science!""

""Ok great! What field?""

""Just science..."" 

You mentioned earlier you don't like doing what's already been done to death, and I can assure you research is a lot more fun when you're interested in the topic. If sea turtles interest you, expand that interest, and learn from the experts!

So taking a small step back, the topic of sea turtles. Biological oceanography will tell you how oceanic processes are affected by sea turtles or how the ocean affects them. Think biology

Physical oceanography can tell you how the things like ocean currents affect the sea turtles. Think physics

Chemical oceanography would be a challenge for sea turtles, I have no idea how you'd link them, but think chemistry for that.

Paleobiology could be interesting as you could look at the lineage and fossils of sea turtles. 

There's just a ton and ton of nuance and you'll have a lot of success if you narrow down the field some more. 

Don't hesitate to ask questions here, if there's one thing you should know about oceanography it's that it's a collaborative science, and none of us would be anywhere if we didn't have help.",,,1614133438,{},gojdc4d,False,t3_lqqbju,False,True,t1_goifrrs,/r/oceanography/comments/lqqbju/paper_for_oceanography/gojdc4d/,1614295479,1,True,False,oceanography,t5_2rez7,,0,[]
[],,AmbivalentSamaritan,,,[],,,,text,t2_mfvd4f,False,False,[],Here’s a jumping off point for the iron one : https://media.nature.com/original/magazine-assets/d41586-020-00393-x/d41586-020-00393-x.pdf,,,1614119977,{},goimj7n,False,t3_lqqbju,False,True,t1_goilivc,/r/oceanography/comments/lqqbju/paper_for_oceanography/goimj7n/,1614282073,1,True,False,oceanography,t5_2rez7,,0,[]
[],,CharlieCola,,,[],,,,text,t2_7lwtxdrt,False,False,[],"Those are weird and awesome, thank you",,,1614119496,{},goilivc,True,t3_lqqbju,False,True,t1_goijz55,/r/oceanography/comments/lqqbju/paper_for_oceanography/goilivc/,1614281534,1,True,False,oceanography,t5_2rez7,,0,[]
[],,AmbivalentSamaritan,,,[],,,,text,t2_mfvd4f,False,False,[],"Ok. Here are a couple less common ideas: 

1- clouds form due to tiny particles in the air called condensation nuclei. Some plankton release dimethylsulfide, which act as cloud condensation nuclei. What ? Plankton causes clouds? 

2- The open ocean is iron poor, so low in Iron that phytoplankton can’t grow. Wind can deposit iron in dust,  causing plankton to bloom, drawing down CO2.  What? Adding iron sucks Co2 out of the atmosphere? “Give me a half a tanker of iron and I'll give you the next ice age.” John Martin 

3- Climate change seems to be favoring jellyfish. Turtles eat jellyfish. But is climate change otherwise favoring turtles?",,,1614118763,{},goijz55,False,t3_lqqbju,False,True,t1_goifrrs,/r/oceanography/comments/lqqbju/paper_for_oceanography/goijz55/,1614280670,2,True,False,oceanography,t5_2rez7,,0,[]
