all_awardings,associated_award,author,author_flair_background_color,author_flair_css_class,author_flair_richtext,author_flair_template_id,author_flair_text,author_flair_text_color,author_flair_type,author_fullname,author_patreon_flair,author_premium,awarders,body,collapsed_because_crowd_control,comment_type,created_utc,gildings,id,is_submitter,link_id,locked,no_follow,parent_id,permalink,retrieved_on,score,send_replies,stickied,subreddit,subreddit_id,top_awarded_type,total_awards_received,treatment_tags
[],,AmbivalentSamaritan,,,[],,,,text,t2_mfvd4f,False,False,[],"Ok. Here are a couple less common ideas: clouds form due to tiny particles in the air called condensation nuclei. Some plankton release dimethylsulfide molecules which acts as cloud condensation nuclei. What ? Plankton causes clouds? 

The open ocean is iron poor, so low in Iron that phytoplankton can’t grow. Wind can deposit iron in dust,  causing plankton to bloom, drawing down CO2.  What? ""Give me a half a tanker of iron and I'll give you the next ice age.” John Martin 

Climate change seems to be favoring jellyfish. Turtles eat jellyfish. But is climate change otherwise favoring turtles?",,,1614117015,{},goig7ow,False,t3_lqqbju,False,False,t3_lqqbju,/r/oceanography/comments/lqqbju/paper_for_oceanography/goig7ow/,1614278522,1,True,False,oceanography,t5_2rez7,,0,[]
[],,CharlieCola,,,[],,,,text,t2_7lwtxdrt,False,False,[],"My assignment is literally anything to do with the oceans. Topography of the red sea, how coral reefs are influences by upwelling, marine organisms, anything.  But I am feeling a bit discouraged on here as I was just told to read a lot of already published papers which is what my prof said.  
I suppose I am not great at asking questions on here, haha, honestly don't know why I try anymore haha.  It gets me no where :)",,,1614116813,{},goifrrs,True,t3_lqqbju,False,True,t1_goiesoo,/r/oceanography/comments/lqqbju/paper_for_oceanography/goifrrs/,1614278291,-2,True,False,oceanography,t5_2rez7,,0,[]
[],,AmbivalentSamaritan,,,[],,,,text,t2_mfvd4f,False,False,[],"Not at all. It’s just hard to figure out what your assignment is, and what kind of suggestions you want.",,,1614116374,{},goiesoo,False,t3_lqqbju,False,True,t1_goi1042,/r/oceanography/comments/lqqbju/paper_for_oceanography/goiesoo/,1614277784,2,True,False,oceanography,t5_2rez7,,0,[]
[],,RickMortyHighIQBot,,,[],,,,text,t2_aexfrksf,False,False,[],Thanks,,,1614114498,{},goia8uy,False,t3_lqqbju,False,True,t1_goia7rw,/r/oceanography/comments/lqqbju/paper_for_oceanography/goia8uy/,1614275367,0,True,False,oceanography,t5_2rez7,,0,[]
[],,Adventurous_Fortune8,,,[],,,,text,t2_84xhoott,False,True,[],You're welcome.,,,1614114487,{},goia7rw,False,t3_lqqbju,False,True,t1_goia6c3,/r/oceanography/comments/lqqbju/paper_for_oceanography/goia7rw/,1614275351,0,True,False,oceanography,t5_2rez7,,0,[]
[],,CharlieCola,,,[],,,,text,t2_7lwtxdrt,False,False,[],Thanks prof,,,1614114472,{},goia6c3,True,t3_lqqbju,False,True,t1_goi83qr,/r/oceanography/comments/lqqbju/paper_for_oceanography/goia6c3/,1614275329,-5,True,False,oceanography,t5_2rez7,,0,[]
[],,BadgerSilver,,,[],,,,text,t2_12qcc2,False,False,[],Ooh good call,,,1616977171,{},gsmw306,False,t3_mcl7xu,False,True,t1_gs51ccz,/r/oceanography/comments/mcl7xu/sea_foam_in_a_narrow_chasm_by_seal_rock_in_oregon/gsmw306/,1616977181,1,True,False,oceanography,t5_2rez7,,0,[]
[],,LordMuck1805,,,[],,,,text,t2_ntb0r,False,False,[],"I'm a hydrographic surveyor. I didn't do an oceanology degree, but lots of my colleagues did. Really easy to step into the industry from it.

One thing to think about is future proofing whatever line of work you go into. Technology is starting to slam into the offshore industry and jobs are going to change a lot over the next 10 years. When you find an industry you're interested in, speak to as many people as possible to make sure your chosen career path won't be obsolete before the end of your career.",,,1616886242,{},gsisooa,False,t3_m8efvk,False,True,t3_m8efvk,/r/oceanography/comments/m8efvk/oceanographer_to_be/gsisooa/,1616888276,1,True,False,oceanography,t5_2rez7,,0,[]
[],,aClimateScientist,,,[],,,,text,t2_1jhkpi0,False,False,[],"From what I’ve gathered about the limited research on Europa / Snowball Earth oceans, the big drives of circulation (and mixing) are geothermal heat flux, which would drive convection from the bottom.",,,1615994764,{},gr8uscy,False,t3_m6vcmr,False,True,t1_gr8py5r,/r/oceanography/comments/m6vcmr/how_long_will_it_take_surface_water_and_deep/gr8uscy/,1615995060,1,True,False,oceanography,t5_2rez7,,0,[]
[],,ItsMetheDeepState,,,[],,,,text,t2_4vz4c8nz,False,False,[],"What an interesting question! 

I'd imagine physical forcing would have been reduced by a ton, but there was still open ocean at the equator so there was 'some' wind.

Then there's brine rejection where new ice could be made. Considering the amount of ice on the planet, maybe the physical mixing comes from the rapid sinking of surface waters?

So much to think about, would be a lot of fun to read about. There's potential insight from the moon Europa, that's an analog for snowball Earth, only more so.",,,1615992488,{},gr8py5r,False,t3_m6vcmr,False,True,t1_gr8ct8c,/r/oceanography/comments/m6vcmr/how_long_will_it_take_surface_water_and_deep/gr8py5r/,1615992563,1,True,False,oceanography,t5_2rez7,,0,[]
[],,aClimateScientist,,,[],,,,text,t2_1jhkpi0,False,False,[],"It’s interesting to think about these physical processes and whether they’ve changed over time. During snowball earths, when the whole ocean was frozen over, was ocean mixing much slower?",,,1615985586,{},gr8ct8c,False,t3_m6vcmr,False,True,t1_gr8coqi,/r/oceanography/comments/m6vcmr/how_long_will_it_take_surface_water_and_deep/gr8ct8c/,1615985597,1,True,False,oceanography,t5_2rez7,,0,[]
[],,aClimateScientist,,,[],,,,text,t2_1jhkpi0,False,False,[],"Without physical mixing or stirring processes, the only process to do the mixing is the molecular thermal (or salt) diffusivity of seawater, which is about k = 1e-7 m^2/s. Using dimensional analysis, we can use the depth of the ocean of about H = 4000 m to estimate a timescale:

T = H^2 / k = 1.6e13 seconds ≈ half a million years. So yeah, physical processes help a lot!",,,1615985509,{},gr8coqi,False,t3_m6vcmr,False,True,t3_m6vcmr,/r/oceanography/comments/m6vcmr/how_long_will_it_take_surface_water_and_deep/gr8coqi/,1615985520,1,True,False,oceanography,t5_2rez7,,0,[]
[],,Hetoxy,,,[],,,,text,t2_9mym3,False,False,[],Modeler?,,,1615952143,{},gr793t9,False,t3_m68fmw,False,True,t1_gr576kv,/r/oceanography/comments/m68fmw/my_10yo_son_wants_to_work_in_oceanography_what/gr793t9/,1615954758,1,True,False,oceanography,t5_2rez7,,0,[]
[],,pacifisht,,,[],,,,text,t2_rrfxg6l,False,False,[],Another thought since you're in a city is summer camp/education programs at local aquariums or universities! Idk how common that practice is but in Florida there's a fair number of ocean-themed education programs.,,,1615924813,{},gr5rl47,False,t3_m68fmw,False,True,t1_gr5pg0p,/r/oceanography/comments/m68fmw/my_10yo_son_wants_to_work_in_oceanography_what/gr5rl47/,1615928284,1,True,False,oceanography,t5_2rez7,,0,[]
[],,NycLegalHelp,,,[],,,,text,t2_11opv8,False,False,[],That's a great idea. I'm in NYC so I think there's one here.,,,1615923835,{},gr5pg0p,True,t3_m68fmw,False,True,t1_gr5l6se,/r/oceanography/comments/m68fmw/my_10yo_son_wants_to_work_in_oceanography_what/gr5pg0p/,1615927155,1,True,False,oceanography,t5_2rez7,,0,[]
[],,[deleted],,,,,,dark,,,,,[],[removed],,,1615923467,{},gr5on11,False,t3_m68fmw,False,True,t3_m68fmw,/r/oceanography/comments/m68fmw/my_10yo_son_wants_to_work_in_oceanography_what/gr5on11/,1615926736,1,True,False,oceanography,t5_2rez7,,0,[]
[],,Achinadav,,,[],,,,text,t2_4mylijzl,False,False,[],"I didn't think to mention that and I should have done. Climateprediction.net makes use of spare compute cycles to run real climate models that are then used by scientists. There's loads of others too. I saw one a couple of years ago with volunteers helping to digitise old ships' records. Not oceanography, but apparently humans are much better at identifying nebulas, star clusters, etc, in astro photography! And folding long proteins got turned into an online game for a bit. There might have been a cloud one too. I wish I could remember the names for you.",,,1615922163,{},gr5lrvw,False,t3_m68fmw,False,True,t1_gr4oif3,/r/oceanography/comments/m68fmw/my_10yo_son_wants_to_work_in_oceanography_what/gr5lrvw/,1615925229,1,True,False,oceanography,t5_2rez7,,0,[]
[],,pacifisht,,,[],,,,text,t2_rrfxg6l,False,False,[],"In addition to what was posted here, you could look for local braches of the American Meteorological Society or other weather/ocean groups. Oceanography has a lot of overlap with weather science and in my local AMS chapter we have young kids who attend our socials and lecture series and come with us on field trips to see weather stations and balloon launches! Honestly they're the best members as they always ask the best questions. 

There may be some specific oceanography group as well locally based that does similar activities open to the public.",,,1615921896,{},gr5l6se,False,t3_m68fmw,False,True,t3_m68fmw,/r/oceanography/comments/m68fmw/my_10yo_son_wants_to_work_in_oceanography_what/gr5l6se/,1615924901,1,True,False,oceanography,t5_2rez7,,0,[]
[],,NycLegalHelp,,,[],,,,text,t2_11opv8,False,False,[],Haha oh no. Please don’t talk to my kid.,,,1615915776,{},gr57frq,True,t3_m68fmw,False,False,t1_gr576kv,/r/oceanography/comments/m68fmw/my_10yo_son_wants_to_work_in_oceanography_what/gr57frq/,1615917704,1,True,False,oceanography,t5_2rez7,,0,[]
[],,frednecker,,,[],,,,text,t2_4k6gjh2p,False,False,[],"I’m an oceanographer. Until Covid, I sat in a cubicle.",,,1615915663,{},gr576kv,False,t3_m68fmw,False,True,t3_m68fmw,/r/oceanography/comments/m68fmw/my_10yo_son_wants_to_work_in_oceanography_what/gr576kv/,1615917569,1,True,False,oceanography,t5_2rez7,,0,[]
[],,NycLegalHelp,,,[],,,,text,t2_11opv8,False,False,[],thank you! let me look into this,,,1615907380,{},gr4oif3,True,t3_m68fmw,False,True,t1_gr4o9zo,/r/oceanography/comments/m68fmw/my_10yo_son_wants_to_work_in_oceanography_what/gr4oif3/,1615907799,1,True,False,oceanography,t5_2rez7,,0,[]
[],,NycLegalHelp,,,[],,,,text,t2_11opv8,False,False,[],thank you both! these are superb ideas :) getting my hands on Blue Planet right now,,,1615907370,{},gr4ohlu,True,t3_m68fmw,False,True,t1_gr4ccev,/r/oceanography/comments/m68fmw/my_10yo_son_wants_to_work_in_oceanography_what/gr4ohlu/,1615907788,1,True,False,oceanography,t5_2rez7,,0,[]
[],,triizzel,,,[],,,,text,t2_2wvccjr3,False,False,[],"Look into citizen (community) science programs. They can be local, regional, or national and you can contribute real data to actual scientific research. They are a lot that focus on marine science topics",,,1615907273,{},gr4o9zo,False,t3_m68fmw,False,True,t3_m68fmw,/r/oceanography/comments/m68fmw/my_10yo_son_wants_to_work_in_oceanography_what/gr4o9zo/,1615907682,1,True,False,oceanography,t5_2rez7,,0,[]
[],,Achinadav,,,[],,,,text,t2_4mylijzl,False,False,[],"And Blue Planet 2, and Frozen Planet! Get him into aquariums and museums; decent oceanography exhibits are hands on and great for kids. I had a great time in the Portland, OR, science museum. There's one in Hobart, Tasmania, that is really good for oceanography. Sorry if they're too far afield, but look them up and see if you can find something more local. Most science museums will have something oceanographically relevant in there, like satellites or ships.

Try googling research vessels, like the RS Sir David Attenborough (UK), RV Investigator (Australia) or Polarstern (Germany). Somewhere I saw a virtual tour that let you walk around the ship. The SDA has had loads of press in the UK and their should be lots of pictures and things. Sometimes there are public open days that let you visit (not now, shame, but hopefully they'll come back).

Lego! Do kids still like Lego? My boss has a Lego model of Halley Base. I'm sure they do a research ship.

A lot of universities and research institutes have some sort of outreach programme. One I helped on had a design a mooring activity and was aimed at under 10's. And we did some experiments with ice cubes. It was great fun. Dye some water blue and freeze it. Then out some in fresh water and some others in salty water. It's fascinating! There's so many fundamental fluid experiments that you can do, have a look on YouTube. I came away exhausted with a new found appreciation for teachers and teaching assistants. My table was basically Lord of the Flies, whilst there's were calm and well behaved.

Does he like computers? Lots of oceanography jobs use computers and coding. I've talked to colleagues with kids about block programming and how young coding is being introduced. It's basically never too early.",,,1615901527,{},gr4ccev,False,t3_m68fmw,False,True,t1_gr48wqi,/r/oceanography/comments/m68fmw/my_10yo_son_wants_to_work_in_oceanography_what/gr4ccev/,1615901538,1,True,False,oceanography,t5_2rez7,,0,[]
[],,Lost_Piece_1911,,,[],,,,text,t2_a9ze6n7c,False,False,[],"Love this! Check out Blue Planet. 

If he wants hands on dats, check out something like the NOAA Buoy System. Find one that interests you (a marine sanctuary, a beach near you, Hawaii) and regularly check to see what the winds are like, the water temps and more.

Check out this webcam at Palmer Station. Make sure he knows oceanographers are the coolest people and get paid to go amazing places.

https://www.usap.gov/videoclipsandmaps/palwebcam.cfm",,,1615899614,{},gr48wqi,False,t3_m68fmw,False,True,t3_m68fmw,/r/oceanography/comments/m68fmw/my_10yo_son_wants_to_work_in_oceanography_what/gr48wqi/,1615899625,1,True,False,oceanography,t5_2rez7,,0,[]
[],,strexcorp-inc,,,[],,,,text,t2_13i99u,False,False,[],Apparently OP wants the subreddit to write a presentation for them and keeps asking until they get t the answers they want,,,1615766454,{},gqyln43,False,t3_m4uh15,False,True,t1_gqw7cr0,/r/oceanography/comments/m4uh15/what_is_the_range_of_rv_in_lowinflow_estuaries/gqyln43/,1615768902,2,True,False,oceanography,t5_2rez7,,0,[]
[],,learningeverythings,,,[],,,,text,t2_ardom6c8,False,False,[],"  
Got it Thanks",,,1615735996,{},gqwksow,True,t3_m4uh15,False,True,t1_gqwievt,/r/oceanography/comments/m4uh15/what_is_the_range_of_rv_in_lowinflow_estuaries/gqwksow/,1615736008,1,True,False,oceanography,t5_2rez7,,0,[]
[],,Lost_Piece_1911,,,[],,,,text,t2_a9ze6n7c,False,False,[],"Mixing occurs mostly with turbulence. 

Turbulence is motion.

 Low inflow estuaries have less motion.

Therefore, low inflow estuaries have low mixing and higher density gradients. 

This is as basic as possible.",,,1615734653,{},gqwievt,False,t3_m4uh15,False,True,t1_gqweb3l,/r/oceanography/comments/m4uh15/what_is_the_range_of_rv_in_lowinflow_estuaries/gqwievt/,1615734664,1,True,False,oceanography,t5_2rez7,,0,[]
[],,xossiane,,,[],,,,text,t2_618350d3,False,False,[],Oh well a fresh hello to you too,,,1615732998,{},gqwfnhw,False,t3_m0nypl,False,True,t3_m0nypl,/r/oceanography/comments/m0nypl/newcomer_to_oceanography/gqwfnhw/,1615733009,1,True,False,oceanography,t5_2rez7,,0,[]
[],,learningeverythings,,,[],,,,text,t2_ardom6c8,False,False,[],"I know but I want it  for my presentation and I am not able  put it in proper words  
If You don't mind can you briefly explain the **slow mixing of fresh and seawater in the low-inflow estuary and any (if)  phenomena that interrupt mixing?**  
Plz",,,1615732125,{},gqweb3l,True,t3_m4uh15,False,True,t1_gqwbh5n,/r/oceanography/comments/m4uh15/what_is_the_range_of_rv_in_lowinflow_estuaries/gqweb3l/,1615732135,1,True,False,oceanography,t5_2rez7,,0,[]
[],,Lost_Piece_1911,,,[],,,,text,t2_a9ze6n7c,False,False,[],"Ive briefly explained 17 times why there is slow mixing in these estuaries. You ask tons of questions and do not like our answers. 

I assume RV is mixing due to tidal forces. QT= RV, find your own ranges, or find a tutor.",,,1615730156,{},gqwbh5n,False,t3_m4uh15,False,True,t3_m4uh15,/r/oceanography/comments/m4uh15/what_is_the_range_of_rv_in_lowinflow_estuaries/gqwbh5n/,1615730168,1,True,False,oceanography,t5_2rez7,,0,[]
[],,Lapidarist,,,[],,,,text,t2_d5voj,False,False,[],Perhaps it would help if you didn't phrase your question like a commanding exam assignment.,,,1615725455,{},gqw7cr0,False,t3_m4uh15,False,True,t3_m4uh15,/r/oceanography/comments/m4uh15/what_is_the_range_of_rv_in_lowinflow_estuaries/gqw7cr0/,1615725465,1,True,False,oceanography,t5_2rez7,,0,[]
[],,rickyfister,,,[],,,,text,t2_yy4c6mi,False,False,[],"What is, fog",,,1615710336,{},gqvscv6,False,t3_m44s6q,False,True,t3_m44s6q,/r/oceanography/comments/m44s6q/what_is_the_effect_called_when_there_is_a_layer/gqvscv6/,1615710347,1,True,False,oceanography,t5_2rez7,,0,[]
[],,learningeverythings,,,[],,,,text,t2_ardom6c8,False,False,[],Can you answer my new posts?,,,1615707188,{},gqvp5ov,True,t3_m3ckl4,False,True,t1_gqpqtw7,/r/oceanography/comments/m3ckl4/what_is_a_different_between_lowinflow_estuary_and/gqvp5ov/,1615707198,1,True,False,oceanography,t5_2rez7,,0,[]
[],,strexcorp-inc,,,[],,,,text,t2_13i99u,False,False,[],I recall losing a few things there too. Don't remember what it all was but if you send it to me I can sort through it,,,1615678193,{},gqui1xx,False,t3_m2eqxo,False,True,t1_gqj38a0,/r/oceanography/comments/m2eqxo/two_hightech_deepsea_robots_that_will_comb_large/gqui1xx/,1615678204,1,True,False,oceanography,t5_2rez7,,0,[]
[],,Triskelion19,,,[],,,,text,t2_1ai0xje,False,False,[],Sensible heat transfer?,,,1615661060,{},gqtmr8k,False,t3_m44s6q,False,False,t3_m44s6q,/r/oceanography/comments/m44s6q/what_is_the_effect_called_when_there_is_a_layer/gqtmr8k/,1615661072,1,True,False,oceanography,t5_2rez7,,0,[]
[],,Lost_Piece_1911,,,[],,,,text,t2_a9ze6n7c,False,False,[],"Sure, youre right. Didnt know if there was a more scientific name haha",,,1615642425,{},gqspdz5,False,t3_m44s6q,False,True,t1_gqsmdq0,/r/oceanography/comments/m44s6q/what_is_the_effect_called_when_there_is_a_layer/gqspdz5/,1615642436,1,True,False,oceanography,t5_2rez7,,0,[]
[],,Vegetable_wow,,,[],,,,text,t2_aesnabyh,False,False,[],"Isn't it usually just called as fog (sea fog or lake fog)? 

[Wikipedia](https://en.wikipedia.org/wiki/Fog#Types) lists different types of fogs by their formation, more precisely it would be then evaporation fog or steam fog.",,,1615640198,{},gqsmdq0,False,t3_m44s6q,False,True,t1_gqsl554,/r/oceanography/comments/m44s6q/what_is_the_effect_called_when_there_is_a_layer/gqsmdq0/,1615640208,1,True,False,oceanography,t5_2rez7,,0,[]
[],,nzrnt,,,[],,,,text,t2_89mqyul7,False,False,[],For sure. Tqvm,,,1615639199,{},gqsl5d2,True,t3_m40ag3,False,True,t1_gqsgr69,/r/oceanography/comments/m40ag3/ocean_modelling_software/gqsl5d2/,1615639210,1,True,False,oceanography,t5_2rez7,,0,[]
[],,Lost_Piece_1911,,,[],,,,text,t2_a9ze6n7c,False,False,[],"Water warms or cools slower than the air. When theres a tempersture gradient and the water is warmer than the air (many mornings), that mist forms. Dont know a name for it.",,,1615639194,{},gqsl554,False,t3_m44s6q,False,True,t3_m44s6q,/r/oceanography/comments/m44s6q/what_is_the_effect_called_when_there_is_a_layer/gqsl554/,1615639205,1,True,False,oceanography,t5_2rez7,,0,[]
[],,hormiguitas,,,[],,,,text,t2_ymjyx,False,False,[],Look at MITGCM or ROMS.,,,1615635187,{},gqsgr69,False,t3_m40ag3,False,True,t1_gqsfgxz,/r/oceanography/comments/m40ag3/ocean_modelling_software/gqsgr69/,1615635198,1,True,False,oceanography,t5_2rez7,,0,[]
[],,nzrnt,,,[],,,,text,t2_89mqyul7,False,False,[],"Sorry for lefting out the detail. 

I would like to model the surface circulation only. So far, i only use following input:

1. Surface elevation from hycom and copernicus marine.

2. U &amp; V velocity component from hycon and copernicus marine.

3. Wind + pressure from Era5.

4. Salinity from hycom. (there is No 1 hourly salinity for copernicus)

5. Temperature from hycom and copernicus marine.

*For hycom data, i use 3.1 analysis 3 hourly
*For copernicus marine data i use 1 hourly data.

After the simulation, i compare again surface elevation and U &amp; V velocity component with hycom/copernicus marine and i get large rmse. 

Any tips/guide u can share for surface modelling?",,,1615633859,{},gqsfgxz,True,t3_m40ag3,False,True,t1_gqs9eln,/r/oceanography/comments/m40ag3/ocean_modelling_software/gqsfgxz/,1615633870,1,True,False,oceanography,t5_2rez7,,0,[]
[],,Ahaterhater,,,[],,,,text,t2_s0uqm,False,False,[],"We use a lot o SWAN for wave modelling at work at this scale and wavewatch only for global scale, however for more integrated modeling SCHISM has been the choice recently for allowing integration of waves and currents on unstrucured grids and has many other ""plugins"", but you're right, we need to understand what op is interested in investigate before been able to reccomend and tools.",,,1615632816,{},gqseh5f,False,t3_m40ag3,False,True,t1_gqs9eln,/r/oceanography/comments/m40ag3/ocean_modelling_software/gqseh5f/,1615632827,1,True,False,oceanography,t5_2rez7,,0,[]
[],,avnibu,,,[],,,,text,t2_6ypjt,False,False,[],"You didn’t say what phenomenon you want to model. Those tools you mentioned are not CFD but free surface elevation model tools (wave) that solve bousinesq equitations in the time domain (I’m greatly simplifying and generalizing here so someone who knows more can correct me if I’m wrong). You may also need to look into solving the waves in the frequency domain. There are other tools that also look into currents under the Mike package. There are also free alternatives too (delft, telemac etc.)

To my knowledge, for ocean waves modeling, tools like wavewatch are also used. 

I’m on mobile so I wrote briefly.",,,1615627264,{},gqs9eln,False,t3_m40ag3,False,True,t3_m40ag3,/r/oceanography/comments/m40ag3/ocean_modelling_software/gqs9eln/,1615627274,1,True,False,oceanography,t5_2rez7,,0,[]
[],,Lost_Piece_1911,,,[],,,,text,t2_a9ze6n7c,False,False,[],"Its rectangles and squares: an inverse estuary is a TYPE of low-inflow estuary. These are estuaries with little freshwater input and less mixing.

Youre asking lots of little questions; why are you focusing on this type of slow mixing estuary?",,,1615572480,{},gqpqtw7,False,t3_m3ckl4,False,True,t1_gqpqgqg,/r/oceanography/comments/m3ckl4/what_is_a_different_between_lowinflow_estuary_and/gqpqtw7/,1615573594,1,True,False,oceanography,t5_2rez7,,0,[]
[],,learningeverythings,,,[],,,,text,t2_ardom6c8,False,False,[],In a low-inflow estuary mixing fresh water and seawater is as slow as an inverse estuary?,,,1615572315,{},gqpqgqg,True,t3_m3ckl4,False,True,t1_gqorffq,/r/oceanography/comments/m3ckl4/what_is_a_different_between_lowinflow_estuary_and/gqpqgqg/,1615573411,1,True,False,oceanography,t5_2rez7,,0,[]
[],,Lost_Piece_1911,,,[],,,,text,t2_a9ze6n7c,False,False,[],https://oceanservice.noaa.gov/education/tutorial_estuaries/est05_circulation.html,,,1615555825,{},gqorffq,False,t3_m3ckl4,False,True,t3_m3ckl4,/r/oceanography/comments/m3ckl4/what_is_a_different_between_lowinflow_estuary_and/gqorffq/,1615555835,1,True,False,oceanography,t5_2rez7,,0,[]
[],,Lost_Piece_1911,,,[],,,,text,t2_a9ze6n7c,False,False,[],Their teacher,,,1615555597,{},gqor1gu,False,t3_m3dsrb,False,True,t1_gqoobvi,/r/oceanography/comments/m3dsrb/what_are_some_similarities_between_oil_and/gqor1gu/,1615555608,1,True,False,oceanography,t5_2rez7,,0,[]
[],,Shovenor_General,,,[],,,,text,t2_7spfstsz,False,False,[],Who wants to know?,,,1615553903,{},gqoobvi,False,t3_m3dsrb,False,True,t3_m3dsrb,/r/oceanography/comments/m3dsrb/what_are_some_similarities_between_oil_and/gqoobvi/,1615553914,1,True,False,oceanography,t5_2rez7,,0,[]
[],,autotldr,,,[],,,,text,t2_6sklr,False,False,[],"This is the best tl;dr I could make, [original](https://www.latimes.com/environment/story/2021-03-10/ddt-seafloor-mapping-catalina-noaa-scripps) reduced by 93%. (I'm a bot)
*****
&gt; When Californians learned in October that the waters off Santa Catalina Island once served as a dumping ground for thousands of barrels of DDT waste, the ocean science community jumped into action.

&gt; &amp;quot;The rediscovery of the massive DDT dumping ground off Southern California is certainly a disaster in need of context - how has the DDT, leaked from thousands of sunken barrels, made its way to the parts of the food chain that Californians rely on?&amp;quot; said Brice Semmens, program director and an associate professor of marine biology at Scripps.

&gt; As many as half a million barrels of DDT waste could be on the seafloor, according to old records and shipping logs.


*****
[**Extended Summary**](http://np.reddit.com/r/autotldr/comments/m2v16o/deepsea_roombas_will_comb_ocean_floor_for_ddt/) | [FAQ](http://np.reddit.com/r/autotldr/comments/31b9fm/faq_autotldr_bot/ ""Version 2.02, ~563395 tl;drs so far."") | [Feedback](http://np.reddit.com/message/compose?to=%23autotldr ""PM's and comments are monitored, constructive feedback is welcome."") | *Top* *keywords*: **DDT**^#1 **ocean**^#2 **scientist**^#3 **barrels**^#4 **need**^#5",,,1615482234,{},gqlaqpc,False,t3_m2eqxo,False,True,t3_m2eqxo,/r/oceanography/comments/m2eqxo/two_hightech_deepsea_robots_that_will_comb_large/gqlaqpc/,1615483588,1,True,False,oceanography,t5_2rez7,,0,[]
[],,Lost_Piece_1911,,,[],,,,text,t2_a9ze6n7c,False,False,[],"It is not a problem, I like answering your questions, but you are lying when you are saying youre on a friends account.

Im only asking about the questions because they are asking for concrete answers about worldwide things. I was curious if you were working in one specific area.",,,1615436711,{},gqj782z,False,t3_m239f6,False,True,t1_gqj6260,/r/oceanography/comments/m239f6/is_there_no_mix_of_freshwater_and_seawater_in_the/gqj782z/,1615441027,1,True,False,oceanography,t5_2rez7,,0,[]
